MCQ,Choices,Correct
Who coined the term machine learning in 1959?,a: Donald Hebb | b: Tom M. Mitchell | c: Arthur Samuel | d: Walter Pitts,c
What was the name of the experimental 'learning machine' developed by Raytheon Company in the early 1960s?,a: Cyberdyne | b: Cybernet | c: Cybertron | d: Cyberspace,c
Who proposed the early mathematical models of neural networks for machine learning algorithms?,a: Warren McCulloch | b: Ray Kurzweil | c: Elon Musk | d: Jeff Bezos,a
What is the main objective of modern-day machine learning?,a: To classify data based on developed models | b: To predict future outcomes based on models | c: Both a and b | d: None of the above,c
"According to Tom M. Mitchell, when is a computer program said to learn from experience?",a: When it improves performance at tasks in T | b: When it has a high performance measure P | c: When it has a lot of experience E | d: When it has a good teacher,a
